{"video_id": "giKwmtsz1U8", "channel_id": "UC8_RSKwbU1OmZWNEoLV1tQg", "fetched_at": "2026-10-02T06:20:42.837261+00:00", "fetch_tool": "yt-dlp 2026.08.19", "caption_track_type": "auto_generated", "segments": [{"start_seconds": 0.99, "end_seconds": 6.0, "text": "[Music]"}, {"start_seconds": 3.02, "end_seconds": 8.46, "text": "okay so now let's go to the next tasks"}, {"start_seconds": 6.0, "end_seconds": 12.26, "text": "and we have the following find all"}, {"start_seconds": 8.46, "end_seconds": 15.36, "text": "customer ID first name order ID quantity"}, {"start_seconds": 12.26, "end_seconds": 17.4, "text": "but include those customers who didn't"}, {"start_seconds": 15.36, "end_seconds": 20.52, "text": "place any orders"}, {"start_seconds": 17.4, "end_seconds": 22.92, "text": "so for us that means we need to see at"}, {"start_seconds": 20.52, "end_seconds": 25.98, "text": "the results of the customers not only"}, {"start_seconds": 22.92, "end_seconds": 28.98, "text": "those customers that did place an order"}, {"start_seconds": 25.98, "end_seconds": 32.4, "text": "but all the customers in order to do"}, {"start_seconds": 28.98, "end_seconds": 34.26, "text": "that we're gonna use the left join so"}, {"start_seconds": 32.4, "end_seconds": 35.94, "text": "we're gonna have exactly the same query"}, {"start_seconds": 34.26, "end_seconds": 38.52, "text": "there is nothing has changed the same"}, {"start_seconds": 35.94, "end_seconds": 41.76, "text": "columns the same tables but instead of"}, {"start_seconds": 38.52, "end_seconds": 43.38, "text": "saying inner join we're gonna work with"}, {"start_seconds": 41.76, "end_seconds": 46.26, "text": "a left join"}, {"start_seconds": 43.38, "end_seconds": 48.54, "text": "and saying lift join that means okay for"}, {"start_seconds": 46.26, "end_seconds": 50.1, "text": "the SQL it's gonna list all the"}, {"start_seconds": 48.54, "end_seconds": 52.5, "text": "customers so let's see what's gonna"}, {"start_seconds": 50.1, "end_seconds": 54.96, "text": "happen if we do that"}, {"start_seconds": 52.5, "end_seconds": 57.84, "text": "let me make it bigger a little bit so as"}, {"start_seconds": 54.96, "end_seconds": 59.88, "text": "you can see here as I said left join we"}, {"start_seconds": 57.84, "end_seconds": 63.3, "text": "have all the informations from the"}, {"start_seconds": 59.88, "end_seconds": 65.58, "text": "customers and only the magic ones from"}, {"start_seconds": 63.3, "end_seconds": 67.26, "text": "the orders alright guys again let's"}, {"start_seconds": 65.58, "end_seconds": 70.62, "text": "understand what the database was doing"}, {"start_seconds": 67.26, "end_seconds": 72.36, "text": "once we executed the left join so that"}, {"start_seconds": 70.62, "end_seconds": 74.46, "text": "way it's going to focus on the customers"}, {"start_seconds": 72.36, "end_seconds": 77.4, "text": "and the orders the database understand"}, {"start_seconds": 74.46, "end_seconds": 80.88, "text": "okay customers is the left table because"}, {"start_seconds": 77.4, "end_seconds": 83.04, "text": "it comes as first with the from and the"}, {"start_seconds": 80.88, "end_seconds": 86.4, "text": "orders is the right table because it"}, {"start_seconds": 83.04, "end_seconds": 88.86, "text": "comes in the left join in the query as a"}, {"start_seconds": 86.4, "end_seconds": 91.38, "text": "second so after that it's gonna specify"}, {"start_seconds": 88.86, "end_seconds": 94.62, "text": "okay the columns again we have the"}, {"start_seconds": 91.38, "end_seconds": 98.16, "text": "customer ID first name"}, {"start_seconds": 94.62, "end_seconds": 100.2, "text": "order ID and quantity and so now it's"}, {"start_seconds": 98.16, "end_seconds": 102.36, "text": "gonna start doing the matching I'm gonna"}, {"start_seconds": 100.2, "end_seconds": 105.36, "text": "check okay which joint type would we"}, {"start_seconds": 102.36, "end_seconds": 107.94, "text": "have we have the lift so since we said"}, {"start_seconds": 105.36, "end_seconds": 109.86, "text": "okay it is the left join the database is"}, {"start_seconds": 107.94, "end_seconds": 112.44, "text": "going to say okay I need everything from"}, {"start_seconds": 109.86, "end_seconds": 115.22, "text": "the left table without doing any matches"}, {"start_seconds": 112.44, "end_seconds": 118.86, "text": "so we need everything so it's gonna list"}, {"start_seconds": 115.22, "end_seconds": 121.14, "text": "all the IDS and as well all the names"}, {"start_seconds": 118.86, "end_seconds": 124.38, "text": "without checking anything"}, {"start_seconds": 121.14, "end_seconds": 126.84, "text": "but from the right side we need only the"}, {"start_seconds": 124.38, "end_seconds": 129.18, "text": "matching records so it's gonna really"}, {"start_seconds": 126.84, "end_seconds": 131.7, "text": "check each one of them so here customer"}, {"start_seconds": 129.18, "end_seconds": 134.64, "text": "ID it exists in the customers"}, {"start_seconds": 131.7, "end_seconds": 135.54, "text": "so it's gonna take it and put it as a"}, {"start_seconds": 134.64, "end_seconds": 138.84, "text": "result"}, {"start_seconds": 135.54, "end_seconds": 142.32, "text": "so now for customer ID 2 we have as well"}, {"start_seconds": 138.84, "end_seconds": 146.76, "text": "one it's gonna put it at the results"}, {"start_seconds": 142.32, "end_seconds": 149.46, "text": "the customer ID 3 there is matching"}, {"start_seconds": 146.76, "end_seconds": 151.92, "text": "but now for Martin he don't have any"}, {"start_seconds": 149.46, "end_seconds": 153.0, "text": "orders so the database is going to show"}, {"start_seconds": 151.92, "end_seconds": 155.9, "text": "nulls"}, {"start_seconds": 153.0, "end_seconds": 155.9, "text": "instead of that"}, {"start_seconds": 157.26, "end_seconds": 162.3, "text": "null it means like an empty there is no"}, {"start_seconds": 159.9, "end_seconds": 164.76, "text": "value found or unknown"}, {"start_seconds": 162.3, "end_seconds": 167.76, "text": "and for better as well there is no"}, {"start_seconds": 164.76, "end_seconds": 169.44, "text": "customer ID with the number five that"}, {"start_seconds": 167.76, "end_seconds": 172.5, "text": "means there is nothing at the right"}, {"start_seconds": 169.44, "end_seconds": 174.84, "text": "sides we will have as well and empty so"}, {"start_seconds": 172.5, "end_seconds": 176.76, "text": "this is how it looks once you execute"}, {"start_seconds": 174.84, "end_seconds": 179.52, "text": "the lift join you will get everything"}, {"start_seconds": 176.76, "end_seconds": 181.74, "text": "from the left and only the matching from"}, {"start_seconds": 179.52, "end_seconds": 183.9, "text": "the right if there is anything missing"}, {"start_seconds": 181.74, "end_seconds": 185.88, "text": "it's gonna put nulls alright so that's"}, {"start_seconds": 183.9, "end_seconds": 188.46, "text": "all for the lift join next we're gonna"}, {"start_seconds": 185.88, "end_seconds": 190.5, "text": "start talking about the right join it is"}, {"start_seconds": 188.46, "end_seconds": 192.06, "text": "very similar to the left join and in the"}, {"start_seconds": 190.5, "end_seconds": 194.82, "text": "video description you will find a link"}, {"start_seconds": 192.06, "end_seconds": 197.28, "text": "to free SQL materials like the database"}, {"start_seconds": 194.82, "end_seconds": 199.14, "text": "and the data of this tutorial the SQL"}, {"start_seconds": 197.28, "end_seconds": 200.94, "text": "sheet sheet and as well all the"}, {"start_seconds": 199.14, "end_seconds": 202.68, "text": "presentations thank you so much for"}, {"start_seconds": 200.94, "end_seconds": 204.42, "text": "watching and I will see you in the next"}, {"start_seconds": 202.68, "end_seconds": 207.42, "text": "tutorial bye"}, {"start_seconds": 204.42, "end_seconds": 207.42, "text": "foreign"}, {"start_seconds": 209.18, "end_seconds": 212.22, "text": "[Music]"}]}