{"video_id": "qBigTkBLU6g", "channel_id": "UCtYLUTtgS3k1Fg4y5tAhLbw", "fetched_at": "2026-10-02T06:24:05.043002+00:00", "fetch_tool": "yt-dlp 2026.08.19", "caption_track_type": "creator_uploaded", "segments": [{"start_seconds": 0.55, "end_seconds": 2.55, "text": "My cat"}, {"start_seconds": 2.74, "end_seconds": 4.74, "text": "does stats"}, {"start_seconds": 4.81, "end_seconds": 6.81, "text": "when she sleeps"}, {"start_seconds": 8.26, "end_seconds": 13.56, "text": "I like to do stats how bout you when I'm awake"}, {"start_seconds": 15.19, "end_seconds": 17.19, "text": "StatQuest"}, {"start_seconds": 18.28, "end_seconds": 20.73, "text": "Hello and welcome to StatQuest!!!"}, {"start_seconds": 21.28, "end_seconds": 28.29, "text": "StatQuest is brought to you by the friendly folks in the genetics department at the University of North Carolina at Chapel Hill"}, {"start_seconds": 29.17, "end_seconds": 33.54, "text": "Today we're going to be talking front histograms, and they're going to be clearly explained"}, {"start_seconds": 35.2, "end_seconds": 39.33, "text": "Imagine we went out and measured someone and they were this tall."}, {"start_seconds": 40.06, "end_seconds": 42.09, "text": "And then we measured someone else"}, {"start_seconds": 43.0, "end_seconds": 45.24, "text": "And then we measured a whole bunch of people"}, {"start_seconds": 46.09, "end_seconds": 51.93, "text": "We've measured so many people that the dots overlap; some dots are completely hidden."}, {"start_seconds": 52.87, "end_seconds": 58.8, "text": "We could try to make it easier to see the hidden measurements by stacking any that are exactly the same"}, {"start_seconds": 60.04, "end_seconds": 66.12, "text": "But measurements that are the exact same are rare and a lot of the hidden measurements are still hidden."}, {"start_seconds": 66.97, "end_seconds": 74.1, "text": "So, instead of stacking measurements that are the exact same we divide the range of values into bins"}, {"start_seconds": 75.4, "end_seconds": 78.57, "text": "And stack the measurements that fall in the same bin"}, {"start_seconds": 79.3, "end_seconds": 81.9, "text": "This, my friends, is a histogram"}, {"start_seconds": 82.93, "end_seconds": 84.91, "text": "Bam"}, {"start_seconds": 84.91, "end_seconds": 90.81, "text": "The taller the stack within a bin the more measurements we made that fall into that bin."}, {"start_seconds": 91.63, "end_seconds": 93.01, "text": "Duh"}, {"start_seconds": 93.01, "end_seconds": 98.13, "text": "We can use the histogram to predict the probability of getting future measurements."}, {"start_seconds": 99.16, "end_seconds": 103.59, "text": "I would be willing to bet that the next measurement we make is somewhere in this range."}, {"start_seconds": 105.46, "end_seconds": 109.86, "text": "Measurements out here are rarer and less likely to happen in the future."}, {"start_seconds": 110.5, "end_seconds": 115.65, "text": "If you want to use a distribution to approximate your data or future measurements,"}, {"start_seconds": 116.59, "end_seconds": 118.86, "text": "histograms are a good way to justify your decision."}, {"start_seconds": 119.8, "end_seconds": 124.77, "text": "By the way, if you don't know what a distribution is, there's a StatQuest for that."}, {"start_seconds": 125.71, "end_seconds": 131.49, "text": "In this case we might use a normal distribution to approximate the data and future measurements."}, {"start_seconds": 132.76, "end_seconds": 134.76, "text": "If the data look like this"}, {"start_seconds": 135.56, "end_seconds": 140.95, "text": "we might use an exponential distribution to approximate this data and future measurements"}, {"start_seconds": 142.82, "end_seconds": 144.2, "text": "Note:"}, {"start_seconds": 144.2, "end_seconds": 147.76, "text": "Figuring out how wide to make the bins is tricky"}, {"start_seconds": 148.49, "end_seconds": 152.23, "text": "If the bins are too narrow, then they are not much help"}, {"start_seconds": 152.75, "end_seconds": 157.84, "text": "In this case the bins are so narrow that pretty much every measurement gets its own bin"}, {"start_seconds": 157.84, "end_seconds": 161.44, "text": "This doesn't give us much more insight than what we had before"}, {"start_seconds": 161.96, "end_seconds": 163.96, "text": "so it's not very useful"}, {"start_seconds": 164.6, "end_seconds": 168.19, "text": "And if the bins are too wide they are not much help"}, {"start_seconds": 168.68, "end_seconds": 174.0, "text": "In this case the bins are so wide that the measurements are split 50/50"}, {"start_seconds": 174.1, "end_seconds": 179.0, "text": "All this tells us this how many measurements are above the average and how many are below"}, {"start_seconds": 179.1, "end_seconds": 182.17, "text": "this is more insight than before, but we can do better"}, {"start_seconds": 184.46, "end_seconds": 189.55, "text": "Sometimes you have to try a bunch of different bin widths before you get a clear picture"}, {"start_seconds": 190.1, "end_seconds": 195.88, "text": "In other words don't rely on the default setting of whatever program you're using to draw the histogram"}, {"start_seconds": 196.55, "end_seconds": 202.72, "text": "You've got to try a bunch of different settings before you're sure that you've got the best histogram you can draw"}, {"start_seconds": 203.57, "end_seconds": 210.67, "text": "Hooray, we've made it to the end of another exciting StatQuest!!! If you like this StatQuest and want to see more like it"}, {"start_seconds": 210.67, "end_seconds": 212.12, "text": "Please subscribe"}, {"start_seconds": 212.12, "end_seconds": 216.64, "text": "It's really easy, and if you have any suggestions for future StatQuests"}, {"start_seconds": 216.71, "end_seconds": 221.23, "text": "Just let me know in the comments below. Until next time... Quest On!!!"}]}