{"video_id": "ZnBQfF5JFDM", "channel_id": "UC4SVo0Ue36XCfOyb5Lh1viQ", "fetched_at": "2026-10-02T06:16:37.101125+00:00", "fetch_tool": "yt-dlp 2026.08.19", "caption_track_type": "creator_uploaded", "segments": [{"start_seconds": 0.0, "end_seconds": 3.2, "text": "hey what's going on everybody it's you"}, {"start_seconds": 1.92, "end_seconds": 4.72, "text": "bro hope you're doing well"}, {"start_seconds": 3.2, "end_seconds": 6.72, "text": "and in this video i'm going to explain"}, {"start_seconds": 4.72, "end_seconds": 11.44, "text": "the return statement in python so"}, {"start_seconds": 6.72, "end_seconds": 11.44, "text": "sit back relax and enjoy the show"}, {"start_seconds": 12.0, "end_seconds": 15.12, "text": "if you find this video helpful please"}, {"start_seconds": 13.6, "end_seconds": 17.44, "text": "remember to like"}, {"start_seconds": 15.12, "end_seconds": 19.44, "text": "comment and subscribe your support will"}, {"start_seconds": 17.44, "end_seconds": 21.92, "text": "help keep this channel running"}, {"start_seconds": 19.44, "end_seconds": 24.0, "text": "alright people let's begin the return"}, {"start_seconds": 21.92, "end_seconds": 24.4, "text": "statement is used within functions to"}, {"start_seconds": 24.0, "end_seconds": 27.12, "text": "send"}, {"start_seconds": 24.4, "end_seconds": 27.84, "text": "python values or objects back to the"}, {"start_seconds": 27.12, "end_seconds": 30.16, "text": "caller"}, {"start_seconds": 27.84, "end_seconds": 30.88, "text": "these values or objects are known as the"}, {"start_seconds": 30.16, "end_seconds": 32.96, "text": "function's"}, {"start_seconds": 30.88, "end_seconds": 34.16, "text": "return value so do you know how with"}, {"start_seconds": 32.96, "end_seconds": 36.4, "text": "functions we can pass"}, {"start_seconds": 34.16, "end_seconds": 37.92, "text": "arguments to a function and then our"}, {"start_seconds": 36.4, "end_seconds": 38.72, "text": "function can do something with those"}, {"start_seconds": 37.92, "end_seconds": 40.72, "text": "arguments"}, {"start_seconds": 38.72, "end_seconds": 42.24, "text": "well not only that but our function can"}, {"start_seconds": 40.72, "end_seconds": 44.72, "text": "pass some value"}, {"start_seconds": 42.24, "end_seconds": 46.16, "text": "or object back to the caller so what"}, {"start_seconds": 44.72, "end_seconds": 48.56, "text": "we'll do for this example"}, {"start_seconds": 46.16, "end_seconds": 50.4, "text": "is create a function that will simply"}, {"start_seconds": 48.56, "end_seconds": 53.04, "text": "multiply two numbers together"}, {"start_seconds": 50.4, "end_seconds": 54.24, "text": "and return the result back to the caller"}, {"start_seconds": 53.04, "end_seconds": 56.56, "text": "so let's define"}, {"start_seconds": 54.24, "end_seconds": 58.48, "text": "a function called multiply and we'll set"}, {"start_seconds": 56.56, "end_seconds": 62.08, "text": "up two parameters for this function"}, {"start_seconds": 58.48, "end_seconds": 65.68, "text": "let's say number one and number two"}, {"start_seconds": 62.08, "end_seconds": 69.52, "text": "and what we'll do is say result"}, {"start_seconds": 65.68, "end_seconds": 71.04, "text": "equals number one times number two"}, {"start_seconds": 69.52, "end_seconds": 72.8, "text": "and then at the end we can return"}, {"start_seconds": 71.04, "end_seconds": 74.88, "text": "something what do we want to return"}, {"start_seconds": 72.8, "end_seconds": 76.56, "text": "let's return whatever the result is"}, {"start_seconds": 74.88, "end_seconds": 78.4, "text": "now when we call this function we will"}, {"start_seconds": 76.56, "end_seconds": 80.4, "text": "pass in two values"}, {"start_seconds": 78.4, "end_seconds": 81.52, "text": "as arguments let's say we would like to"}, {"start_seconds": 80.4, "end_seconds": 84.32, "text": "multiply six"}, {"start_seconds": 81.52, "end_seconds": 86.08, "text": "times eight so when we run this while we"}, {"start_seconds": 84.32, "end_seconds": 87.92, "text": "can't actually see anything"}, {"start_seconds": 86.08, "end_seconds": 89.28, "text": "when we return the result after"}, {"start_seconds": 87.92, "end_seconds": 91.52, "text": "multiplying numbers"}, {"start_seconds": 89.28, "end_seconds": 93.36, "text": "one and two it's going to return the"}, {"start_seconds": 91.52, "end_seconds": 95.12, "text": "result back to the caller"}, {"start_seconds": 93.36, "end_seconds": 96.8, "text": "in order to see the value that is"}, {"start_seconds": 95.12, "end_seconds": 98.96, "text": "returned back to the caller"}, {"start_seconds": 96.8, "end_seconds": 101.28, "text": "one way in which we can do this is to"}, {"start_seconds": 98.96, "end_seconds": 103.6, "text": "print the value that is returned"}, {"start_seconds": 101.28, "end_seconds": 104.64, "text": "within a print statement so what we'll"}, {"start_seconds": 103.6, "end_seconds": 107.12, "text": "do is print"}, {"start_seconds": 104.64, "end_seconds": 108.72, "text": "the value that is returned after calling"}, {"start_seconds": 107.12, "end_seconds": 111.76, "text": "the multiply function"}, {"start_seconds": 108.72, "end_seconds": 112.8, "text": "so 6 times 8 is really great 6 times 8"}, {"start_seconds": 111.76, "end_seconds": 115.12, "text": "is 48"}, {"start_seconds": 112.8, "end_seconds": 117.44, "text": "now one other thing that we can do is"}, {"start_seconds": 115.12, "end_seconds": 118.4, "text": "store the returned value within a"}, {"start_seconds": 117.44, "end_seconds": 122.0, "text": "variable"}, {"start_seconds": 118.4, "end_seconds": 124.24, "text": "so let's say x equals multiply"}, {"start_seconds": 122.0, "end_seconds": 126.32, "text": "6 times 8 and then we will print"}, {"start_seconds": 124.24, "end_seconds": 129.52, "text": "whatever x is"}, {"start_seconds": 126.32, "end_seconds": 131.52, "text": "so the result is still the same of 48"}, {"start_seconds": 129.52, "end_seconds": 133.44, "text": "now with the return value there is"}, {"start_seconds": 131.52, "end_seconds": 134.08, "text": "another way in which we could write this"}, {"start_seconds": 133.44, "end_seconds": 136.08, "text": "that uses"}, {"start_seconds": 134.08, "end_seconds": 138.48, "text": "less lines of code so we'll delete this"}, {"start_seconds": 136.08, "end_seconds": 140.72, "text": "first line and instead of returning"}, {"start_seconds": 138.48, "end_seconds": 142.08, "text": "a variable called result what we'll do"}, {"start_seconds": 140.72, "end_seconds": 144.8, "text": "is just return"}, {"start_seconds": 142.08, "end_seconds": 146.96, "text": "number one times number two and this"}, {"start_seconds": 144.8, "end_seconds": 149.2, "text": "would work the same as it does before"}, {"start_seconds": 146.96, "end_seconds": 150.72, "text": "but it's written in less lines of code"}, {"start_seconds": 149.2, "end_seconds": 151.76, "text": "so that's another way in which you could"}, {"start_seconds": 150.72, "end_seconds": 153.28, "text": "write this"}, {"start_seconds": 151.76, "end_seconds": 155.36, "text": "all right everybody so that is the"}, {"start_seconds": 153.28, "end_seconds": 157.6, "text": "return statement functions can send"}, {"start_seconds": 155.36, "end_seconds": 159.68, "text": "python values or objects"}, {"start_seconds": 157.6, "end_seconds": 161.44, "text": "back to the caller these values or"}, {"start_seconds": 159.68, "end_seconds": 163.92, "text": "objects are known as the function's"}, {"start_seconds": 161.44, "end_seconds": 166.24, "text": "return value you can either print this"}, {"start_seconds": 163.92, "end_seconds": 168.8, "text": "value directly to the console window"}, {"start_seconds": 166.24, "end_seconds": 170.08, "text": "or you can store it within a variable or"}, {"start_seconds": 168.8, "end_seconds": 172.0, "text": "some other location"}, {"start_seconds": 170.08, "end_seconds": 175.76, "text": "and well ladies and gentlemen that is"}, {"start_seconds": 172.0, "end_seconds": 178.16, "text": "how the return statement works in python"}, {"start_seconds": 175.76, "end_seconds": 179.12, "text": "hey you yeah i'm talking to you if you"}, {"start_seconds": 178.16, "end_seconds": 181.6, "text": "learned something new"}, {"start_seconds": 179.12, "end_seconds": 182.24, "text": "then help me help you in three easy"}, {"start_seconds": 181.6, "end_seconds": 184.32, "text": "steps"}, {"start_seconds": 182.24, "end_seconds": 185.44, "text": "by smashing that like button drop a"}, {"start_seconds": 184.32, "end_seconds": 187.2, "text": "comment down below"}, {"start_seconds": 185.44, "end_seconds": 199.84, "text": "and subscribe if you'd like to become a"}, {"start_seconds": 187.2, "end_seconds": 199.84, "text": "fellow bro"}, {"start_seconds": 200.21, "end_seconds": 209.46, "text": "[Music]"}, {"start_seconds": 209.84, "end_seconds": 211.92, "text": "you"}]}