{"video_id": "tJzdMnxiSmI", "channel_id": "UCBQ1xwKIJmxY1LWHy6q0_TQ", "fetched_at": "2026-10-02T06:26:19.036115+00:00", "fetch_tool": "yt-dlp 2026.08.19", "caption_track_type": "auto_generated", "segments": [{"start_seconds": 0.0, "end_seconds": 5.0, "text": "What is descriptive statistics?"}, {"start_seconds": 2.56, "end_seconds": 7.52, "text": "Descriptive statistics is the process of"}, {"start_seconds": 5.0, "end_seconds": 9.88, "text": "organizing, summarizing, and presenting"}, {"start_seconds": 7.52, "end_seconds": 12.28, "text": "data. What is statistics? Why do you"}, {"start_seconds": 9.88, "end_seconds": 16.8, "text": "need statistics in the first place? When"}, {"start_seconds": 12.28, "end_seconds": 18.76, "text": "you start analyzing the data in detail,"}, {"start_seconds": 16.8, "end_seconds": 21.88, "text": "that which is not visible to the human"}, {"start_seconds": 18.76, "end_seconds": 24.44, "text": "eye, be that with through visualization"}, {"start_seconds": 21.88, "end_seconds": 26.32, "text": "or just by reading through the numbers,"}, {"start_seconds": 24.44, "end_seconds": 29.28, "text": "when there's something that is not"}, {"start_seconds": 26.32, "end_seconds": 31.76, "text": "visible to the human eye, so that's what"}, {"start_seconds": 29.28, "end_seconds": 33.4, "text": "gets analyzed in statistics. So you have"}, {"start_seconds": 31.76, "end_seconds": 35.68, "text": "two types of statistics. One is"}, {"start_seconds": 33.4, "end_seconds": 38.28, "text": "descriptive statistics, another is"}, {"start_seconds": 35.68, "end_seconds": 40.44, "text": "inferential statistics. So in"}, {"start_seconds": 38.28, "end_seconds": 42.28, "text": "descriptive statistics, which is also a"}, {"start_seconds": 40.44, "end_seconds": 44.56, "text": "part of descriptive analytics, so as"}, {"start_seconds": 42.28, "end_seconds": 47.04, "text": "I've already explained to you, analytics"}, {"start_seconds": 44.56, "end_seconds": 49.28, "text": "is broadly classified into four types."}, {"start_seconds": 47.04, "end_seconds": 51.96, "text": "Descriptive analytics, diagnostic"}, {"start_seconds": 49.28, "end_seconds": 54.36, "text": "analytics, predictive analytics, and"}, {"start_seconds": 51.96, "end_seconds": 57.64, "text": "prescriptive analytics. In descriptive"}, {"start_seconds": 54.36, "end_seconds": 60.24, "text": "analytics, you deal with data that is of"}, {"start_seconds": 57.64, "end_seconds": 62.16, "text": "that's past. It's an archive of data."}, {"start_seconds": 60.24, "end_seconds": 64.56, "text": "You work on the archive. So descriptive"}, {"start_seconds": 62.16, "end_seconds": 67.16, "text": "statistics describes, it organizes,"}, {"start_seconds": 64.56, "end_seconds": 68.84, "text": "summarizes, and it presents the data."}, {"start_seconds": 67.16, "end_seconds": 71.48, "text": "It's not only on the past data, even the"}, {"start_seconds": 68.84, "end_seconds": 73.96, "text": "present data is up you can subject it to"}, {"start_seconds": 71.48, "end_seconds": 76.4, "text": "descriptive statistics. So what does it"}, {"start_seconds": 73.96, "end_seconds": 79.24, "text": "give you an information about?"}, {"start_seconds": 76.4, "end_seconds": 82.08, "text": "What is the average monthly sales? Which"}, {"start_seconds": 79.24, "end_seconds": 85.16, "text": "product sells the most? How much do"}, {"start_seconds": 82.08, "end_seconds": 87.36, "text": "customers purchase"}, {"start_seconds": 85.16, "end_seconds": 89.72, "text": "purchases vary?"}, {"start_seconds": 87.36, "end_seconds": 92.36, "text": "What is the highest and lowest revenue?"}, {"start_seconds": 89.72, "end_seconds": 95.04, "text": "What does a typical customer spend look"}, {"start_seconds": 92.36, "end_seconds": 98.48, "text": "like? So most of these questions are"}, {"start_seconds": 95.04, "end_seconds": 100.48, "text": "answered through descriptive statistics."}, {"start_seconds": 98.48, "end_seconds": 102.2, "text": "So how do we run descriptive statistics?"}, {"start_seconds": 100.48, "end_seconds": 104.8, "text": "It's very easy. Through data frame."}, {"start_seconds": 102.2, "end_seconds": 106.44, "text": "Okay, so now if we have to take a look"}, {"start_seconds": 104.8, "end_seconds": 108.52, "text": "at the data frame in the first place. So"}, {"start_seconds": 106.44, "end_seconds": 111.32, "text": "in Pandas, you have data frame."}, {"start_seconds": 108.52, "end_seconds": 114.44, "text": "So data frame is a statistical function"}, {"start_seconds": 111.32, "end_seconds": 117.0, "text": "in Python libraries. Okay, so data frame"}, {"start_seconds": 114.44, "end_seconds": 120.6, "text": "can be used when it comes to the usage"}, {"start_seconds": 117.0, "end_seconds": 123.28, "text": "of pandas. Okay? So, within pandas, when"}, {"start_seconds": 120.6, "end_seconds": 125.64, "text": "you import data from a CSV file or when"}, {"start_seconds": 123.28, "end_seconds": 127.64, "text": "you import data from a data set, it is"}, {"start_seconds": 125.64, "end_seconds": 129.08, "text": "first converted into a data frame. And"}, {"start_seconds": 127.64, "end_seconds": 131.6, "text": "within data frame, there are several"}, {"start_seconds": 129.08, "end_seconds": 133.4, "text": "functions. So, data frame. There"}, {"start_seconds": 131.6, "end_seconds": 135.4, "text": "There are basic summary functions like"}, {"start_seconds": 133.4, "end_seconds": 137.4, "text": "count, sum, mean, median, mode,"}, {"start_seconds": 135.4, "end_seconds": 139.16, "text": "dispersion, and shape functions"}, {"start_seconds": 137.4, "end_seconds": 141.24, "text": "pertaining to descriptive statistics"}, {"start_seconds": 139.16, "end_seconds": 143.88, "text": "that includes standard deviation,"}, {"start_seconds": 141.24, "end_seconds": 146.24, "text": "variance, minimum, quantile, skewness,"}, {"start_seconds": 143.88, "end_seconds": 147.88, "text": "kurtosis, describing the data which"}, {"start_seconds": 146.24, "end_seconds": 150.36, "text": "gives you the basic description about"}, {"start_seconds": 147.88, "end_seconds": 151.96, "text": "the data. Quartile, percentile, and then"}, {"start_seconds": 150.36, "end_seconds": 154.8, "text": "you have advanced functions like"}, {"start_seconds": 151.96, "end_seconds": 156.32, "text": "correlation, covariance. Okay, so as a"}, {"start_seconds": 154.8, "end_seconds": 158.48, "text": "part of today's agenda, we'll be"}, {"start_seconds": 156.32, "end_seconds": 160.24, "text": "covering correlation and causation. So,"}, {"start_seconds": 158.48, "end_seconds": 162.32, "text": "within data frames, when you create a"}, {"start_seconds": 160.24, "end_seconds": 164.24, "text": "data frame, there are some inbuilt"}, {"start_seconds": 162.32, "end_seconds": 165.8, "text": "functions which you can directly use and"}, {"start_seconds": 164.24, "end_seconds": 167.8, "text": "it makes your life much more easier."}, {"start_seconds": 165.8, "end_seconds": 169.6, "text": "Okay, most of the statistical functions"}, {"start_seconds": 167.8, "end_seconds": 171.52, "text": "can be applied to data frame. So, you"}, {"start_seconds": 169.6, "end_seconds": 173.48, "text": "don't have to search anywhere else."}, {"start_seconds": 171.52, "end_seconds": 175.36, "text": "Directly, you can use it. Okay?"}, {"start_seconds": 173.48, "end_seconds": 177.24, "text": "Otherwise, those statistical functions"}, {"start_seconds": 175.36, "end_seconds": 179.2, "text": "are again found as a part of numpy."}, {"start_seconds": 177.24, "end_seconds": 181.36, "text": "Numpy also has some statistical"}, {"start_seconds": 179.2, "end_seconds": 183.52, "text": "functions implemented and some part of"}, {"start_seconds": 181.36, "end_seconds": 186.24, "text": "the machine learning also has some"}, {"start_seconds": 183.52, "end_seconds": 189.08, "text": "statistics basics here in W3Schools. So,"}, {"start_seconds": 186.24, "end_seconds": 190.52, "text": "you can also refer to W3Schools because"}, {"start_seconds": 189.08, "end_seconds": 192.84, "text": "the previous sessions we were referring"}, {"start_seconds": 190.52, "end_seconds": 195.28, "text": "to it, so you found it easy to follow"}, {"start_seconds": 192.84, "end_seconds": 198.04, "text": "and execute. You can very much follow"}, {"start_seconds": 195.28, "end_seconds": 198.04, "text": "here as well."}]}