{"video_id": "RiEZ_hEf96A", "channel_id": "UCtYLUTtgS3k1Fg4y5tAhLbw", "fetched_at": "2026-10-02T06:08:35.003830+00:00", "fetch_tool": "yt-dlp 2026.08.19", "caption_track_type": "auto_generated", "segments": [{"start_seconds": 0.72, "end_seconds": 4.92, "text": "hello and welcome to another stat"}, {"start_seconds": 2.8, "end_seconds": 8.84, "text": "quickie today we're going to talk about"}, {"start_seconds": 4.92, "end_seconds": 10.76, "text": "pie charts versus bar charts I typically"}, {"start_seconds": 8.84, "end_seconds": 13.68, "text": "prefer that if you're going to if you"}, {"start_seconds": 10.76, "end_seconds": 15.36, "text": "want to present data as a pie chart that"}, {"start_seconds": 13.68, "end_seconds": 17.72, "text": "what you do is you use a bar chart"}, {"start_seconds": 15.36, "end_seconds": 19.52, "text": "instead and so to keep this quick I'm"}, {"start_seconds": 17.72, "end_seconds": 21.44, "text": "just going to show you some examples of"}, {"start_seconds": 19.52, "end_seconds": 24.2, "text": "why I think a bar chart is better than a"}, {"start_seconds": 21.44, "end_seconds": 28.2, "text": "pie chart here's a pie chart showing how"}, {"start_seconds": 24.2, "end_seconds": 30.16, "text": "much Herman sleeps Works eats and rests"}, {"start_seconds": 28.2, "end_seconds": 32.12, "text": "what I don't like about this chart is"}, {"start_seconds": 30.16, "end_seconds": 35.28, "text": "it's hard to tell how much more time"}, {"start_seconds": 32.12, "end_seconds": 38.32, "text": "Herman spends sleeping or working they"}, {"start_seconds": 35.28, "end_seconds": 40.8, "text": "both look very similar in size with a"}, {"start_seconds": 38.32, "end_seconds": 42.8, "text": "bar chart it's obvious that Herman"}, {"start_seconds": 40.8, "end_seconds": 45.0, "text": "spends an hour more working each day"}, {"start_seconds": 42.8, "end_seconds": 46.96, "text": "than he spends sleeping we can also"}, {"start_seconds": 45.0, "end_seconds": 49.48, "text": "easily see that he spends an hour more"}, {"start_seconds": 46.96, "end_seconds": 52.52, "text": "resting than eating the bar chart makes"}, {"start_seconds": 49.48, "end_seconds": 54.76, "text": "this obvious with two pie charts the"}, {"start_seconds": 52.52, "end_seconds": 57.16, "text": "data become even more difficult to"}, {"start_seconds": 54.76, "end_seconds": 60.52, "text": "interpret here we have Herman versus"}, {"start_seconds": 57.16, "end_seconds": 64.24, "text": "Earl here's a question does Earl work"}, {"start_seconds": 60.52, "end_seconds": 66.4, "text": "more than Herman and if so how much more"}, {"start_seconds": 64.24, "end_seconds": 69.4, "text": "with pie charts this question is"}, {"start_seconds": 66.4, "end_seconds": 72.0, "text": "surprisingly difficult to answer in"}, {"start_seconds": 69.4, "end_seconds": 74.0, "text": "contrast with a Bart chart it's much"}, {"start_seconds": 72.0, "end_seconds": 76.76, "text": "easier to answer this question and"}, {"start_seconds": 74.0, "end_seconds": 79.84, "text": "others like it here we see that Herman"}, {"start_seconds": 76.76, "end_seconds": 82.52, "text": "sleeps about 30 minutes longer than Earl"}, {"start_seconds": 79.84, "end_seconds": 86.12, "text": "we also see that Herman Works about 40"}, {"start_seconds": 82.52, "end_seconds": 88.48, "text": "minutes longer than Earl Earl eats for"}, {"start_seconds": 86.12, "end_seconds": 90.92, "text": "an hour longer than Herman and Earl also"}, {"start_seconds": 88.48, "end_seconds": 92.84, "text": "rests an hour longer than her terine"}, {"start_seconds": 90.92, "end_seconds": 95.2, "text": "this is why I like bar charts more than"}, {"start_seconds": 92.84, "end_seconds": 97.04, "text": "pie charts so next time you're thinking"}, {"start_seconds": 95.2, "end_seconds": 99.32, "text": "about drawing a pie chart consider"}, {"start_seconds": 97.04, "end_seconds": 101.8, "text": "drawing a bar chart instead it saves"}, {"start_seconds": 99.32, "end_seconds": 103.64, "text": "space and it's easier to interpret all"}, {"start_seconds": 101.8, "end_seconds": 106.76, "text": "right that's it for this stat quickie"}, {"start_seconds": 103.64, "end_seconds": 106.76, "text": "tune in next time"}]}