{"video_id": "tYBOMw7Ob8E", "channel_id": "UC7cs8q-gJRlGwj4A8OmCmXg", "fetched_at": "2026-10-02T06:26:27.158141+00:00", "fetch_tool": "yt-dlp 2026.08.19", "caption_track_type": "auto_generated", "segments": [{"start_seconds": 0.06, "end_seconds": 3.42, "text": "what is going on everybody my name is"}, {"start_seconds": 1.77, "end_seconds": 5.88, "text": "Alex fabric and today we're gonna be"}, {"start_seconds": 3.42, "end_seconds": 7.23, "text": "looking at the having clause now they"}, {"start_seconds": 5.88, "end_seconds": 9.33, "text": "haven't class I feel a little bit"}, {"start_seconds": 7.23, "end_seconds": 10.44, "text": "unappreciated in the sequel community"}, {"start_seconds": 9.33, "end_seconds": 12.51, "text": "and I feel like it doesn't get a lot of"}, {"start_seconds": 10.44, "end_seconds": 14.58, "text": "love and so today I wanted to describe"}, {"start_seconds": 12.51, "end_seconds": 16.11, "text": "how to use it what it's used for"}, {"start_seconds": 14.58, "end_seconds": 18.63, "text": "so before we use the having clause I"}, {"start_seconds": 16.11, "end_seconds": 20.52, "text": "want to set up our query here we want to"}, {"start_seconds": 18.63, "end_seconds": 21.93, "text": "use an aggregate function in the group"}, {"start_seconds": 20.52, "end_seconds": 25.14, "text": "by statement and then I will show you"}, {"start_seconds": 21.93, "end_seconds": 28.35, "text": "how to use this having clause so let's"}, {"start_seconds": 25.14, "end_seconds": 33.75, "text": "look at the job title and let's look at"}, {"start_seconds": 28.35, "end_seconds": 37.83, "text": "the count of job titles and then down"}, {"start_seconds": 33.75, "end_seconds": 42.93, "text": "here we need to do group by job title"}, {"start_seconds": 37.83, "end_seconds": 44.61, "text": "and let's execute this and here is our"}, {"start_seconds": 42.93, "end_seconds": 47.19, "text": "job titles and here's the count of how"}, {"start_seconds": 44.61, "end_seconds": 48.81, "text": "many people have those job titles so now"}, {"start_seconds": 47.19, "end_seconds": 50.58, "text": "let's say we want to look at all the"}, {"start_seconds": 48.81, "end_seconds": 56.43, "text": "jobs that have more than one person in"}, {"start_seconds": 50.58, "end_seconds": 61.74, "text": "that specific job so let's do where the"}, {"start_seconds": 56.43, "end_seconds": 65.07, "text": "count of job title is greater"}, {"start_seconds": 61.74, "end_seconds": 68.01, "text": "oops is greater than one and let's run"}, {"start_seconds": 65.07, "end_seconds": 69.36, "text": "that and as you can see we're gonna get"}, {"start_seconds": 68.01, "end_seconds": 72.12, "text": "this message right here now let's read"}, {"start_seconds": 69.36, "end_seconds": 74.31, "text": "it an aggregate may not appear in the"}, {"start_seconds": 72.12, "end_seconds": 77.46, "text": "where clause unless it is in a sub query"}, {"start_seconds": 74.31, "end_seconds": 80.37, "text": "contained in a having clause or a select"}, {"start_seconds": 77.46, "end_seconds": 83.37, "text": "list and the column being aggregated is"}, {"start_seconds": 80.37, "end_seconds": 85.26, "text": "an outer reference what that is"}, {"start_seconds": 83.37, "end_seconds": 87.03, "text": "basically saying is is we cannot use"}, {"start_seconds": 85.26, "end_seconds": 89.73, "text": "this aggregate function in the where"}, {"start_seconds": 87.03, "end_seconds": 92.19, "text": "statement we need to use a having clause"}, {"start_seconds": 89.73, "end_seconds": 98.1, "text": "so let's get rid of this and let's say"}, {"start_seconds": 92.19, "end_seconds": 100.46, "text": "having the count of job title greater"}, {"start_seconds": 98.1, "end_seconds": 103.05, "text": "than one I did the same thing again and"}, {"start_seconds": 100.46, "end_seconds": 105.3, "text": "let's execute this and we're still gonna"}, {"start_seconds": 103.05, "end_seconds": 107.7, "text": "get an error now why are we getting that"}, {"start_seconds": 105.3, "end_seconds": 110.22, "text": "error the reason is is because this"}, {"start_seconds": 107.7, "end_seconds": 112.29, "text": "having statement is completely dependent"}, {"start_seconds": 110.22, "end_seconds": 113.76, "text": "on the group by statement because we're"}, {"start_seconds": 112.29, "end_seconds": 115.77, "text": "performing this after it has been"}, {"start_seconds": 113.76, "end_seconds": 118.86, "text": "aggregated so this having statement"}, {"start_seconds": 115.77, "end_seconds": 121.59, "text": "actually needs to go after the group by"}, {"start_seconds": 118.86, "end_seconds": 123.27, "text": "statement because we can't look at the"}, {"start_seconds": 121.59, "end_seconds": 125.4, "text": "aggregated information before it's"}, {"start_seconds": 123.27, "end_seconds": 128.46, "text": "actually aggregated in that group by"}, {"start_seconds": 125.4, "end_seconds": 131.7, "text": "statement so now let's run this and it"}, {"start_seconds": 128.46, "end_seconds": 133.11, "text": "worked perfectly so now we only have the"}, {"start_seconds": 131.7, "end_seconds": 133.88, "text": "jobs that have more than one employee"}, {"start_seconds": 133.11, "end_seconds": 137.3, "text": "for"}, {"start_seconds": 133.88, "end_seconds": 140.84, "text": "job title so now let's look at one more"}, {"start_seconds": 137.3, "end_seconds": 143.87, "text": "example let's do the average let's say"}, {"start_seconds": 140.84, "end_seconds": 147.14, "text": "salary and let's get rid of this having"}, {"start_seconds": 143.87, "end_seconds": 148.79, "text": "Clause real quick and just to look at"}, {"start_seconds": 147.14, "end_seconds": 154.15, "text": "this information"}, {"start_seconds": 148.79, "end_seconds": 160.03, "text": "let's do order by and we'll do average"}, {"start_seconds": 154.15, "end_seconds": 163.64, "text": "salary so let's look at this and we have"}, {"start_seconds": 160.03, "end_seconds": 165.14, "text": "36,000 265 thousand so in the middle we"}, {"start_seconds": 163.64, "end_seconds": 166.96, "text": "got forty four thousand five hundred so"}, {"start_seconds": 165.14, "end_seconds": 175.04, "text": "let's use this having statement and"}, {"start_seconds": 166.96, "end_seconds": 179.06, "text": "let's stay the average of salary where"}, {"start_seconds": 175.04, "end_seconds": 182.66, "text": "it is greater than forty five thousand"}, {"start_seconds": 179.06, "end_seconds": 185.72, "text": "and we actually need to put this right"}, {"start_seconds": 182.66, "end_seconds": 188.45, "text": "here right after the group by and before"}, {"start_seconds": 185.72, "end_seconds": 191.03, "text": "the order by so let's run this and see"}, {"start_seconds": 188.45, "end_seconds": 192.65, "text": "what we get and it works perfectly so"}, {"start_seconds": 191.03, "end_seconds": 194.66, "text": "now we're looking at the job titles that"}, {"start_seconds": 192.65, "end_seconds": 196.85, "text": "have an average salary of over forty"}, {"start_seconds": 194.66, "end_seconds": 198.8, "text": "five thousand dollars so there you go"}, {"start_seconds": 196.85, "end_seconds": 200.6, "text": "that is the having clause definitely one"}, {"start_seconds": 198.8, "end_seconds": 203.39, "text": "that is good to know and is very useful"}, {"start_seconds": 200.6, "end_seconds": 205.43, "text": "in specific situations thank you guys so"}, {"start_seconds": 203.39, "end_seconds": 206.9, "text": "much for watching I really appreciate it"}, {"start_seconds": 205.43, "end_seconds": 208.67, "text": "if you liked this video or learned"}, {"start_seconds": 206.9, "end_seconds": 212.41, "text": "anything today be sure to subscribe"}, {"start_seconds": 208.67, "end_seconds": 212.41, "text": "below and I'll see you in the next video"}]}