{"video_id": "fHLhBnmwUM0", "channel_id": "UCtYLUTtgS3k1Fg4y5tAhLbw", "fetched_at": "2026-10-02T06:19:58.273951+00:00", "fetch_tool": "yt-dlp 2026.08.19", "caption_track_type": "auto_generated", "segments": [{"start_seconds": 0.4, "end_seconds": 8.8, "text": "StatQuest is so cool."}, {"start_seconds": 4.24, "end_seconds": 8.8, "text": "When you watch it, you're no fool."}, {"start_seconds": 9.28, "end_seconds": 13.2, "text": "That's what makes it cool."}, {"start_seconds": 15.2, "end_seconds": 19.72, "text": "Hello and welcome to StatQuest."}, {"start_seconds": 17.92, "end_seconds": 21.4, "text": "StatQuest is brought to you by the"}, {"start_seconds": 19.72, "end_seconds": 23.44, "text": "friendly folks in the genetics"}, {"start_seconds": 21.4, "end_seconds": 26.24, "text": "department at the University of North"}, {"start_seconds": 23.44, "end_seconds": 27.52, "text": "Carolina at Chapel Hill."}, {"start_seconds": 26.24, "end_seconds": 30.04, "text": "Today we're going to be talking about"}, {"start_seconds": 27.52, "end_seconds": 35.4, "text": "box plots."}, {"start_seconds": 30.04, "end_seconds": 37.52, "text": "Box plots are bad to the bone."}, {"start_seconds": 35.4, "end_seconds": 40.0, "text": "Check them out."}, {"start_seconds": 37.52, "end_seconds": 42.08, "text": "Sometimes box plots are called box and"}, {"start_seconds": 40.0, "end_seconds": 44.16, "text": "whisker plots."}, {"start_seconds": 42.08, "end_seconds": 47.0, "text": "Here's the box."}, {"start_seconds": 44.16, "end_seconds": 49.48, "text": "And here the whiskers."}, {"start_seconds": 47.0, "end_seconds": 51.8, "text": "The line in the middle of the box is the"}, {"start_seconds": 49.48, "end_seconds": 55.44, "text": "median value."}, {"start_seconds": 51.8, "end_seconds": 58.44, "text": "50% of the data is above the median."}, {"start_seconds": 55.44, "end_seconds": 60.56, "text": "50% of the data is below the median."}, {"start_seconds": 58.44, "end_seconds": 63.04, "text": "Medians are useful because they're not"}, {"start_seconds": 60.56, "end_seconds": 66.08, "text": "as swayed by outliers as the typical"}, {"start_seconds": 63.04, "end_seconds": 68.48, "text": "mean or average is."}, {"start_seconds": 66.08, "end_seconds": 71.52, "text": "George Carlin, host of the children's"}, {"start_seconds": 68.48, "end_seconds": 72.88, "text": "television show Shining Time Station,"}, {"start_seconds": 71.52, "end_seconds": 74.68, "text": "once said,"}, {"start_seconds": 72.88, "end_seconds": 77.0, "text": "\"Think of how stupid the average person"}, {"start_seconds": 74.68, "end_seconds": 78.8, "text": "is and realize that half of them are"}, {"start_seconds": 77.0, "end_seconds": 80.6, "text": "stupider than that.\""}, {"start_seconds": 78.8, "end_seconds": 82.88, "text": "I think Mr. Carlin was referring to the"}, {"start_seconds": 80.6, "end_seconds": 85.64, "text": "median, not the average, but that's"}, {"start_seconds": 82.88, "end_seconds": 88.92, "text": "okay. It's still funny."}, {"start_seconds": 85.64, "end_seconds": 91.88, "text": "Within the box itself, we have 25% of"}, {"start_seconds": 88.92, "end_seconds": 94.88, "text": "the data above the median"}, {"start_seconds": 91.88, "end_seconds": 98.88, "text": "and 25% of the data below the median."}, {"start_seconds": 94.88, "end_seconds": 101.48, "text": "So, 50% of the data is within the box."}, {"start_seconds": 98.88, "end_seconds": 103.28, "text": "Outliers are plotted as dots beyond the"}, {"start_seconds": 101.48, "end_seconds": 106.04, "text": "whiskers."}, {"start_seconds": 103.28, "end_seconds": 108.36, "text": "Toats bad to the bone."}, {"start_seconds": 106.04, "end_seconds": 111.08, "text": "It's common to overlay the original data"}, {"start_seconds": 108.36, "end_seconds": 113.32, "text": "onto the box plots."}, {"start_seconds": 111.08, "end_seconds": 115.88, "text": "Now it's easy to see that this guy"}, {"start_seconds": 113.32, "end_seconds": 118.4, "text": "didn't get many measurements."}, {"start_seconds": 115.88, "end_seconds": 120.56, "text": "And this guy got tons of"}, {"start_seconds": 118.4, "end_seconds": 123.52, "text": "This means we'll be more confident in"}, {"start_seconds": 120.56, "end_seconds": 126.64, "text": "the statistics calculated from this guy."}, {"start_seconds": 123.52, "end_seconds": 129.2, "text": "Super totes bad to the bone."}, {"start_seconds": 126.64, "end_seconds": 131.84, "text": "Bask in the awesomeness of box plots"}, {"start_seconds": 129.2, "end_seconds": 135.4, "text": "compared to the traditional bar plots."}, {"start_seconds": 131.84, "end_seconds": 137.72, "text": "Both graphs show the exact same data."}, {"start_seconds": 135.4, "end_seconds": 140.4, "text": "Hooray! We've made it to the end of"}, {"start_seconds": 137.72, "end_seconds": 143.24, "text": "another exciting stat quest. Tune in"}, {"start_seconds": 140.4, "end_seconds": 144.64, "text": "next time for another fun adventure."}, {"start_seconds": 143.24, "end_seconds": 147.16, "text": "If you like what you've seen and want to"}, {"start_seconds": 144.64, "end_seconds": 148.76, "text": "see more of it, please subscribe. And if"}, {"start_seconds": 147.16, "end_seconds": 151.16, "text": "you have something specific that you'd"}, {"start_seconds": 148.76, "end_seconds": 154.28, "text": "like to learn more about, just put it in"}, {"start_seconds": 151.16, "end_seconds": 154.28, "text": "the comments below."}]}